url,name,address,city,state,phone
https://www.abbottaccountingsolutions.com/,Results,"ÓÉą131 Broad St, Claremont, NH 03743",Claremont,NH,Óāį(603) 493-8479
https://wallachandwallach.com/,Results,"ÓÉą1 Juniper Cir, Hancock, NH 03449",Hancock,NH,Óāį(603) 899-7568
http://www.markstilescpa.com/,Results,"ÓÉą148 Blake Rd, Epping, NH 03042",Epping,NH,Óāį(866) 627-2721
https://www.esthersawyercpa.com/,Results,"ÓÉą18 Overlook Cir, Barrington, NH 03825",Barrington,NH,Óāį(603) 507-1004
https://www.cpmtax.com/?utm_source=google&utm_medium=google_business_profile&utm_campaign=website_click,Results,"ÓÉą563 NH-106 Unit 6, Loudon, NH 03307",Loudon,NH,Óāį(603) 798-4100
https://doleaccountingservices.com/,Results,"ÓÉą721 Nh Rte 4a, Enfield, NH 03748",Enfield,NH,Óāį(603) 632-3980
https://my-cpa.com/,Results,"ÓÉą481 White Mountain Hwy, Conway, NH 03818",Conway,NH,Óāį(603) 447-3356
http://www.abacusmanagementinc.com/,Results,"ÓÉą75 ŠąěŠąÉŠčćŠä≠ ŠąėŠäēŠĆąŠčĶ, Colebrook, NH 03576",Colebrook,NH,Óāį(603) 237-5543
http://www.ridgeline-accounting.com/,Results,"ÓÉąNorth Sutton, NH 03260",ÓÉąNorth Sutton,NH,Óāį(802) 522-6931
http://www.twardycpa.com/,Results,"ÓÉą24 Pine Grove Rd, Sunapee, NH 03782",Sunapee,NH,Óāį(603) 763-0350
http://www.dalessio.com/,Results,"ÓÉą543 West St, Keene, NH 03431",Keene,NH,Óāį(603) 352-1000
http://maureendowstcpa.com/,Results,"ÓÉą2 Mont Vernon Rd, New Boston, NH 03070",New Boston,NH,Óāį(603) 487-3531
https://edwardscpagroup.com/,Results,"ÓÉą51 Park St, Northfield, NH 03276",Northfield,NH,Óāį(603) 286-8000
https://echelonaccounting.com/,Results,"ÓÉą111 Saranac St STE 1, Littleton, NH 03561",Littleton,NH,Óāį(603) 991-0428
http://brauelcpas.com/,Results,"ÓÉą2977 White Mountain Hwy, North Conway, NH 03860",North Conway,NH,Óāį(603) 356-9421
https://abbottaccountingsolutions.com/,Results,"ÓÉą409 Elm St Ste 100, Manchester, NH 03101",Manchester,NH,Óāį(603) 493-8479
https://www.early.cpa/,Results,"ÓÉą156 Broad St, Claremont, NH 03743",Claremont,NH,Óāį(603) 543-3882
http://pleasantlakeaccounting.com/,Results,"ÓÉą3A Pleasant Ln, Warner, NH 03278",Warner,NH,Óāį(603) 746-3097
http://www.nhscpa.org/,Results,"ÓÉą1750 Elm St #403, Manchester, NH 03104",Manchester,NH,Óāį(603) 622-1999
http://www.keelercpa.com/,Results,"ÓÉą110 Cottage St, Littleton, NH 03561",Littleton,NH,Óāį(603) 444-7272
http://williamjsheacpa.com/,Results,"ÓÉą400 Amherst St Suite 304, Nashua, NH 03063",Nashua,NH,Óāį(603) 672-1830
http://jelibbycpa.com/,Results,"ÓÉą60 Whittier Hwy, Moultonborough, NH 03254",Moultonborough,NH,Óāį(603) 253-5408
http://zelekandassociates.com/,Results,"ÓÉą1088 Whittier Hwy, Moultonborough, NH 03254",Moultonborough,NH,Óāį(603) 476-9789
http://www.rhowellsconsulting.com/,Results,"ÓÉą6 Loudon Rd # 205, Concord, NH 03301",Concord,NH,Óāį(603) 224-3224
https://www.youngclausco.com/,Results,"ÓÉą65 Lafayette Rd # 102, North Hampton, NH 03862",North Hampton,NH,Óāį(603) 964-2772
https://liguoricpa.com/,Results,,Ashuelot,NH,Óāį(603) 263-5032
http://www.wjkrausecpa.com/,Results,"ÓÉą8 Governor John Wentworth Hwy, Wolfeboro, NH 03894",Wolfeboro,NH,Óāį(603) 569-4222
https://www.whitemountainaccounting.com/?utm_source=google&utm_medium=wix_google_business_profile&utm_campaign=5167469860586908453,Results,"ÓÉą330 Sheridan Rd, Moultonborough, NH 03254",Moultonborough,NH,Óāį(603) 916-0797
https://eltcpa.com/,Results,"ÓÉą22 Bridge St Suite 11, Concord, NH 03301",Concord,NH,Óāį(508) 759-8328
https://www.alacartebookkeeping.com/,Results,"ÓÉą17 Conway Ln, Haverhill, NH 03765",Haverhill,NH,Óāį(603) 235-4749
http://www.bwtfs.com/,Results,"ÓÉą288 S River Rd building c unit 2, Bedford, NH 03110",Bedford,NH,Óāį(603) 232-5913
http://www.batcheldercpa.com/,Results,"ÓÉą428 Main St, Keene, NH 03431",Keene,NH,Óāį(802) 476-9490
http://www.ampeisch.com/,Results,"ÓÉą24 Airport Rd Ste 402, West Lebanon, NH 03784",West Lebanon,NH,Óāį(603) 306-0100
http://www.caronbletzer.com/,Results,"ÓÉą1 Library Ln, Kingston, NH 03848",Kingston,NH,Óāį(855) 620-4600
http://www.dffcpas.com/,Results,"ÓÉą472 High St, Somersworth, NH 03878",Somersworth,NH,Óāį(603) 692-5358
https://www.bristol-group.net/,Results,"ÓÉą1328 Hooksett Rd Ste 45 #16597, Hooksett, NH 03106",Hooksett,NH,Óāį(603) 644-1113
http://www.accountingbychristine.com/,Results,"ÓÉą246 Calef Hill Rd, Tilton, NH 03276",Tilton,NH,Óāį(603) 860-7406
http://www.clmcpa.com/,Results,"ÓÉą118 Portsmouth Ave Suite D206, Stratham, NH 03885",Stratham,NH,Óāį(603) 772-3460
http://gkhashemcpa.com/,Results,"ÓÉą276 Newport Rd Suite 218, New London, NH 03257",New London,NH,Óāį(603) 526-6809
https://chickeringcpa.com/,Results,"ÓÉą61 North St #9, Manchester, NH 03104",Manchester,NH,Óāį(603) 621-9156
http://www.uppervalleycpa.com/,Results,"ÓÉą31 Old Etna Rd STE N4, Lebanon, NH 03766",Lebanon,NH,Óāį(603) 448-6200
http://www.dbrohdecpa.com/,Results,"ÓÉą55 Smith Bridge Rd, Plymouth, NH 03264",Plymouth,NH,Óāį(603) 536-1557
https://www.nhtaxaccounting.com/,Results,"ÓÉą98 Spit Brook Rd Ste 404, Nashua, NH 03062",Nashua,NH,Óāį(603) 718-8578
http://www.maloneyandkennedy.com/,Results,"ÓÉą15 Dartmouth Dr # 203, Auburn, NH 03032",Auburn,NH,Óāį(603) 624-8819
http://www.dsbcpas.com/,Results,"ÓÉą376 Court St, Laconia, NH 03246",Laconia,NH,Óāį(603) 524-0507
https://bhka.com/,Results,"ÓÉą12 Cotton Rd, Nashua, NH 03063",Nashua,NH,Óāį(603) 595-8000
https://www.gelinascpa.com/,Results,"ÓÉą36 Salmon St, Manchester, NH 03104",Manchester,NH,Óāį(603) 625-8931
https://rmwaccounting.com/offices/new-hampshire/lincoln-nh/,Results,"ÓÉą195 Main St, Lincoln, NH 03251",Lincoln,NH,Óāį(603) 745-3121
http://www.prjcpa.com/,Results,"ÓÉą542 Mast Rd, Goffstown, NH 03045",Goffstown,NH,Óāį(603) 627-4320
http://pelletiertaxservice.com/,Results,"ÓÉą188 Milton Rd, Rochester, NH 03868",Rochester,NH,Óāį(603) 335-8080
http://www.richardpaulcpa.com/,Results,"ÓÉą842 Hartford Ave., White River Junction, VT 05001",White River Junction,VT,Óāį(802) 698-0332
http://www.nhtaxaccounting.com/,Results,"ÓÉą98 Spit Brook Rd Suite 404, Nashua, NH 03062",Nashua,NH,Óāį(603) 718-8578
http://www.nathanwechsler.com/,Results,"ÓÉą70 Commercial St # 401, Concord, NH 03301",Concord,NH,Óāį(603) 224-5357
http://www.erjcpa.com/,Results,"ÓÉą43 Demeritt Ave, Lee, NH 03861",Lee,NH,Óāį(603) 275-5657
http://amyjcpa.com/,Results,"ÓÉąUnit 5 at 24, Southmayd Rd, Campton, NH 03223",Campton,NH,Óāį(603) 747-4145
http://www.carewwells.com/,Results,"ÓÉą104 N State St, Concord, NH 03301",Concord,NH,Óāį(603) 224-3950
http://etbsnh.com/,Results,"ÓÉą1078 Laconia Rd, Belmont, NH 03220",Belmont,NH,Óāį(603) 369-6693
http://www.cindycourtneycpa.com/,Results,"ÓÉą64 Lafayette Rd #7, North Hampton, NH 03862",North Hampton,NH,Óāį(603) 964-2988
https://www.erctax.com/,Results,"ÓÉą75 Newport Rd #101, New London, NH 03257",New London,NH,Óāį(603) 526-7777
http://www.altaircpa.com/,Results,"ÓÉą2 Bedford Farms Dr #102, Bedford, NH 03110",Bedford,NH,Óāį(603) 621-6188
https://www.stevengeercpa.com/,Results,"ÓÉąGilford, NH 03249",ÓÉąGilford,NH,Óāį(603) 293-0426
http://www.taxpronh.com/,Results,"ÓÉą6 Chenell Dr #280, Concord, NH 03301",Concord,NH,Óāį(603) 228-3004
https://www.eastrockaccount.com/,Results,,Ashuelot,NH,Óāį(857) 855-9326
https://www.petrocpa.net/,Results,"ÓÉą170 S River Rd Ste 103, Bedford, NH 03110",Bedford,NH,Óāį(603) 645-5254
https://eltcpa.com/about-us-cpa/,Results,,Ashuelot,NH,Óāį(508) 759-8328
http://www.pignatielloandco.com/,Results,"ÓÉą7 Main St, Atkinson, NH 03811",Atkinson,NH,Óāį(603) 362-8383
http://www.247-cpa.com/,Results,"ÓÉą317 Farrwood Dr, Haverhill, MA 01835",Haverhill,MA,Óāį(978) 257-1287
https://www.raichecpa.com/?utm_source=Next&utm_medium=Google_Website,Results,"ÓÉą16 Wakefield St, Rochester, NH 03867",Rochester,NH,Óāį(603) 330-1040
https://www.nh-cpas.com/,Results,"ÓÉą29 Mill St Unit D1, Wolfeboro, NH 03894",Wolfeboro,NH,Óāį(800) 220-5521
https://www.mountainviewtaxnh.com/,Results,,Ashuelot,NH,Óāį(603) 285-9123
http://www.rust.cpa/,Results,"ÓÉą217R Old Homestead Hwy, Swanzey, NH 03446",Swanzey,NH,Óāį(603) 358-6565
https://paramount.tax/amherst,Results,"ÓÉą12 Middle St Ste 7B, Amherst, NH 03031",Amherst,NH,Óāį(603) 757-5980
http://www.alsfeldtaxservice.com/,Results,"ÓÉą109 Main St, Wilton, NH 03086",Wilton,NH,Óāį(603) 654-2874
https://granitetowntax.com/,Results,"ÓÉą80 South St Suite 2, Milford, NH 03055",Milford,NH,Óāį(603) 801-0175
https://larsontaxservice.com/,Results,"ÓÉą185 S Main St, Newton, NH 03858",Newton,NH,Óāį(603) 382-0382
https://www.facebook.com/Beausejourtaxservice,Results,"ÓÉą44 Main St Ste 56r, Gorham, NH 03581",Gorham,NH,Óāį(603) 466-5077
http://irstaxresolutionservice.com/,Results,"ÓÉą21 Hampton Rd STE 101, Exeter, NH 03833",Exeter,NH,Óāį(603) 724-2288
https://www.venningadvisors.com/,Results,"ÓÉą84 W Broadway, Derry, NH 03038",Derry,NH,Óāį(603) 434-7500
http://lfstaxgroup.com/,Results,"ÓÉą607 Tenney Mountain Hwy Suite 131, Plymouth, NH 03264",Plymouth,NH,Óāį(603) 624-5060
http://www.taxworkroom.com/,Results,"ÓÉą46 Opera House Sq, Claremont, NH 03743",Claremont,NH,Óāį(603) 287-8395
https://mmaccountingnh.com/,Results,"ÓÉą65 Lafayette Rd Suite 302A, North Hampton, NH 03862",North Hampton,NH,Óāį(603) 601-4515
http://automatedtaxservices.net/,Results,"ÓÉą820 Colebrook Rd, Errol, NH 03579",Errol,NH,Óāį(413) 531-9073
https://kenbookkeepingtaxes.com/,Results,"ÓÉą91 Chester Rd, Auburn, NH 03032",Auburn,NH,Óāį(603) 512-5277
http://www.wesolveirsproblems.com/,Results,"ÓÉą21 Dauntless Ln, Plaistow, NH 03865",Plaistow,NH,Óāį(603) 382-3552
http://ktsmonroe.com/,Results,"ÓÉą131 Harley View Dr, Monroe, NH 03771",Monroe,NH,Óāį(603) 638-2120
https://londonderryaccountant.com/,Results,"ÓÉą50 Nashua Rd Ste 211, Londonderry, NH 03053",Londonderry,NH,Óāį(603) 432-3394
http://www.payrollnh.com/,Results,"ÓÉą93 Plaistow Rd c3, Plaistow, NH 03865",Plaistow,NH,Óāį(603) 382-7114
https://druketax.com/,Results,"ÓÉą3 Executive Park Dr, Bedford, NH 03110",Bedford,NH,Óāį(603) 226-2226
http://www.lmrpa.com/,Results,"ÓÉą273 Locust St Suite 207, Dover, NH 03820",Dover,NH,Óāį(603) 749-2700
https://www.sftbllc.com/about-us.html,Results,"ÓÉą60 Rochester Hill Rd, Rochester, NH 03867",Rochester,NH,Óāį(603) 948-2933
